<!ELEMENT Grocery (ProductCategory*) >
<!ELEMENT ProductCategory  (Product*) >
<!ELEMENT Product ANY>

<!ATTLIST ProductCategory
        id CDATA #REQUIRED
        categoryName CDATA #REQUIRED
        >
<!ATTLIST Product
        id CDATA #REQUIRED
        productName CDATA #REQUIRED
        amount CDATA #REQUIRED
        price CDATA #REQUIRED
        >

